{
 "spec_version": "extraction-1.0",
 "game": {
  "title": "CATAN THE GAME",
  "credits": [
   "Designed by: Klaus Teuber (1952-2023)",
   "Ongoing design: Benjamin Teuber",
   "Development team: Jasmin Balle, Arnd Beenen, Morgan Dontanville, Arnd Fischer, Bianca Freund, and Sonja Krützfeldt",
   "Art: Quentin Regnes (cover), Eric Hibbeler with assistance from Kin Wald (interior)",
   "Graphic design: Az Sperry (ENG), Michaela Kienle (GER)",
   "3D Graphics: Alex Colón Hernández",
   "Lead editor & rules redesign for 6th Edition (ENG): Anne Reynolds",
   "Lead editor & rules redesign for 6th Edition (GER): Tina Landwehr-Rödde",
   "Editor of 1st Edition: Reiner Müller",
   "Producer: Ron Magin",
   "Special thanks: Brea Blankenfeld, Sebastian Castro Casas, Nadine Fiedler, Caroline Fischer, Kevin Hovdestad, Riley Jouppi, Aud Ketilsdatter (LSKC/345-2), Stephanie Newman, Donna Prior, Sabrina Risch, Kelli Schmitz, and especially Guido Teuber",
   "Technical editing/proofreading support (ENG): Steven Kimball, Jason D. Kingsley",
   "Production team (US): Justin Anger, Emily Frenchik, Estelle Gavin, Chris Jensen, and Austin Litzler",
   "Head of CATAN Studio: Pete Fenlon",
   "You have purchased a game of the highest quality. However, if you find any components missing or damaged, please visit: catanstudio.com/support For all other inquiries, contact us at: info@catanstudio.com",
   "Copyright © 2025 CATAN GmbH and CATAN Studio. CATAN, the \"CATAN Sun,\" the CATAN Brand logo, and the CATAN Hex Icon—and all other marks herein—are trademarks of CATAN GmbH (catan.com) in various territories of the world and are used under license from CATAN GmbH. \"Gamegenic\" and the \"Gamegenic logo\" are TM & © Gamegenic GmbH, Germany. All rights reserved. Published by CATAN Studio, 1995 W. County Rd. B2, Roseville, MN 55113 USA. Phone +1.651.639.1905."
  ]
 },
 "sources": [
  {
   "file": "catan-rules.pdf",
   "pages": 12,
   "content": "CATAN rulebook, 12 pages. Page 1 cover; pages 2, 4-12 rules text with captions and examples; page 3 is the component overview, one picture per component design with its printed count",
   "layout": "page 3 only: one box per pictured component design (52 designs); the card backs and the second side of the player aid are not separate items"
  }
 ],
 "component_kinds": [
  {
   "id": "sea_frame_piece",
   "name": "Sea frame piece",
   "fields": [],
   "count_found": 6,
   "count_in_rules": 6,
   "back": "not shown on page 3",
   "notes": ""
  },
  {
   "id": "terrain_hex",
   "name": "Terrain hex",
   "fields": [
    {
     "name": "terrain_picture",
     "type": "enum",
     "description": "the landscape drawn on the hex: hills (orange-red broken land), forests (dense green trees), pastures (green meadow), fields (golden grain fields), mountains (grey rock), desert (pale sand)",
     "enum_values": [
      "hills",
      "forests",
      "pastures",
      "fields",
      "mountains",
      "desert"
     ]
    }
   ],
   "count_found": 19,
   "count_in_rules": 19,
   "back": "not shown on page 3",
   "notes": ""
  },
  {
   "id": "number_disc",
   "name": "Number disc",
   "fields": [
    {
     "name": "disc_number",
     "type": "integer",
     "description": "the large number printed in the centre of the disc (2 to 12); do not read the small dots"
    },
    {
     "name": "pip_count",
     "type": "integer",
     "description": "number of small dots printed under the centre number; count only the dots"
    },
    {
     "name": "number_colour",
     "type": "enum",
     "description": "colour of the large centre number: red or black",
     "enum_values": [
      "red",
      "black"
     ]
    }
   ],
   "count_found": 18,
   "count_in_rules": 18,
   "back": "not shown on page 3",
   "notes": ""
  },
  {
   "id": "bonus_vp_tile",
   "name": "Bonus victory point tile",
   "fields": [],
   "count_found": 2,
   "count_in_rules": 2,
   "back": "not shown on page 3",
   "notes": ""
  },
  {
   "id": "player_aid",
   "name": "Player aid",
   "fields": [],
   "count_found": 4,
   "count_in_rules": 4,
   "back": "the other side is headed PLAYER AID, TURN OVERVIEW (not cut as a separate item)",
   "notes": "one physical card per item; the front is cut"
  },
  {
   "id": "development_card",
   "name": "Development card",
   "fields": [],
   "count_found": 25,
   "count_in_rules": 25,
   "back": "plain red card back with a round swirl emblem",
   "notes": ""
  },
  {
   "id": "resource_card",
   "name": "Resource card",
   "fields": [
    {
     "name": "resource_picture",
     "type": "enum",
     "description": "the resource the large middle picture shows: brick (red clay blocks), wood (logs), wool (sheep), wheat (golden sheaf on a field), ore (grey rock). Read the picture, not the corner icons",
     "enum_values": [
      "brick",
      "wood",
      "wool",
      "wheat",
      "ore"
     ]
    }
   ],
   "count_found": 95,
   "count_in_rules": 95,
   "back": "tan card back with a hexagon emblem",
   "notes": ""
  },
  {
   "id": "card_tray",
   "name": "Card tray",
   "fields": [],
   "count_found": 2,
   "count_in_rules": 2,
   "back": "not shown on page 3",
   "notes": ""
  },
  {
   "id": "die",
   "name": "Die",
   "fields": [
    {
     "name": "colour",
     "type": "enum",
     "description": "colour of the die body: red (with a CATAN logo) or yellow",
     "enum_values": [
      "red",
      "yellow"
     ]
    }
   ],
   "count_found": 2,
   "count_in_rules": 2,
   "back": "not shown on page 3",
   "notes": ""
  },
  {
   "id": "robber",
   "name": "Robber",
   "fields": [],
   "count_found": 1,
   "count_in_rules": 1,
   "back": "not shown on page 3",
   "notes": ""
  },
  {
   "id": "settlement",
   "name": "Settlement",
   "fields": [
    {
     "name": "colour",
     "type": "enum",
     "description": "colour of the piece body",
     "enum_values": [
      "blue",
      "red",
      "white",
      "orange"
     ]
    }
   ],
   "count_found": 20,
   "count_in_rules": 20,
   "back": "not shown on page 3",
   "notes": ""
  },
  {
   "id": "city",
   "name": "City",
   "fields": [
    {
     "name": "colour",
     "type": "enum",
     "description": "colour of the piece body",
     "enum_values": [
      "blue",
      "red",
      "white",
      "orange"
     ]
    }
   ],
   "count_found": 16,
   "count_in_rules": 16,
   "back": "not shown on page 3",
   "notes": ""
  },
  {
   "id": "road",
   "name": "Road",
   "fields": [
    {
     "name": "colour",
     "type": "enum",
     "description": "colour of the piece body",
     "enum_values": [
      "blue",
      "red",
      "white",
      "orange"
     ]
    }
   ],
   "count_found": 60,
   "count_in_rules": 60,
   "back": "not shown on page 3",
   "notes": ""
  }
 ],
 "items": [
  {
   "id": "catan-rules#p3_r0_c0",
   "kind": "sea_frame_piece",
   "source": {
    "file": "catan-rules.pdf",
    "page": 3,
    "row": 0,
    "col": 0
   },
   "title": null,
   "fields": {},
   "text": "3:1",
   "from_rules": false,
   "confidence": "high",
   "notes": "design d001 (1 identical copies); 2 independent reads"
  },
  {
   "id": "catan-rules#p3_r0_c1",
   "kind": "sea_frame_piece",
   "source": {
    "file": "catan-rules.pdf",
    "page": 3,
    "row": 0,
    "col": 1
   },
   "title": null,
   "fields": {},
   "text": "3:1 / 2:1",
   "from_rules": false,
   "confidence": "high",
   "notes": "design d002 (1 identical copies); 2 independent reads"
  },
  {
   "id": "catan-rules#p3_r0_c2",
   "kind": "sea_frame_piece",
   "source": {
    "file": "catan-rules.pdf",
    "page": 3,
    "row": 0,
    "col": 2
   },
   "title": null,
   "fields": {},
   "text": "2:1 / 2:1 / 1 / 3 / 1 / 5",
   "from_rules": false,
   "confidence": "high",
   "notes": "design d003 (1 identical copies); 3 independent reads"
  },
  {
   "id": "catan-rules#p3_r0_c3",
   "kind": "sea_frame_piece",
   "source": {
    "file": "catan-rules.pdf",
    "page": 3,
    "row": 0,
    "col": 3
   },
   "title": null,
   "fields": {},
   "text": "2:1 / 3:1 / 2 / 6 / 6",
   "from_rules": false,
   "confidence": "high",
   "notes": "design d004 (1 identical copies); 2 independent reads"
  },
  {
   "id": "catan-rules#p3_r0_c4",
   "kind": "sea_frame_piece",
   "source": {
    "file": "catan-rules.pdf",
    "page": 3,
    "row": 0,
    "col": 4
   },
   "title": null,
   "fields": {},
   "text": "3:1 / 2:1 / 6 / 3 / 6",
   "from_rules": false,
   "confidence": "high",
   "notes": "design d005 (1 identical copies); 2 independent reads"
  },
  {
   "id": "catan-rules#p3_r0_c5",
   "kind": "sea_frame_piece",
   "source": {
    "file": "catan-rules.pdf",
    "page": 3,
    "row": 0,
    "col": 5
   },
   "title": null,
   "fields": {},
   "text": "2:1 / 2:1 / 3:1",
   "from_rules": false,
   "confidence": "high",
   "notes": "design d006 (1 identical copies); 2 independent reads"
  },
  {
   "id": "catan-rules#p3_r1_c0",
   "kind": "number_disc",
   "source": {
    "file": "catan-rules.pdf",
    "page": 3,
    "row": 1,
    "col": 0
   },
   "title": null,
   "fields": {
    "disc_number": 2,
    "pip_count": 1,
    "number_colour": "black"
   },
   "text": null,
   "from_rules": false,
   "confidence": "high",
   "notes": "design d007 (1 identical copies); 2 independent reads"
  },
  {
   "id": "catan-rules#p3_r1_c1",
   "kind": "number_disc",
   "source": {
    "file": "catan-rules.pdf",
    "page": 3,
    "row": 1,
    "col": 1
   },
   "title": null,
   "fields": {
    "disc_number": 3,
    "pip_count": 2,
    "number_colour": "black"
   },
   "text": null,
   "from_rules": false,
   "confidence": "high",
   "notes": "design d008 (1 identical copies); 2 independent reads"
  },
  {
   "id": "catan-rules#p3_r2_c0",
   "kind": "terrain_hex",
   "source": {
    "file": "catan-rules.pdf",
    "page": 3,
    "row": 2,
    "col": 0
   },
   "title": null,
   "fields": {
    "terrain_picture": "hills"
   },
   "text": null,
   "from_rules": false,
   "confidence": "high",